<?xml version="1.0" ?>
<!-- version 1.3.0 -->
<xs:schema xmlns:xs="http://www.w3.org/2001/XMLSchema">
  <xs:element name="projectlist">
    <xs:complexType>
      <xs:sequence>
        <xs:element name="description" type="xs:string" minOccurs="1" maxOccurs="1"/>
        <xs:element name="project" type="project" minOccurs="1" maxOccurs="unbounded"/>
      </xs:sequence>
    </xs:complexType>
  </xs:element>
  <xs:complexType name="project">
    <xs:sequence>
      <xs:element name="name" type="xs:string" minOccurs="1" maxOccurs="1"/>
      <xs:element name="type" minOccurs="1" maxOccurs="1">
        <xs:simpleType>
          <xs:restriction base="xs:string">
            <xs:enumeration value="git"/>
          </xs:restriction>
        </xs:simpleType>
      </xs:element>
      <xs:element name="connection" type="xs:string" minOccurs="1" maxOccurs="1"/>
      <xs:element name="webview-url" type="xs:string" minOccurs="0" maxOccurs="1"/>
      <xs:element name="tag" type="xs:string" minOccurs="0" maxOccurs="1"/>
      <xs:element name="src-subpath" type="xs:string" minOccurs="0" maxOccurs="1" default=".">
        <xs:annotation>
          <xs:documentation>
            Value of the -dir option for the PMD run.
            The value must be a directory path relative to the root directory of the clone.
            Defaults to just '.', ie the entire directory.
          </xs:documentation>
        </xs:annotation>
      </xs:element>
      <xs:element name="exclude-pattern" type="xs:string" minOccurs="0" maxOccurs="unbounded"/>
      <xs:element name="build-command" type="xs:string" minOccurs="0" maxOccurs="1"/>
      <xs:element name="auxclasspath-command" type="xs:string" minOccurs="0" maxOccurs="1"/>
      <xs:element name="cpd-options" type="cpd-options" minOccurs="0" maxOccurs="1"/>
    </xs:sequence>
  </xs:complexType>
  <xs:complexType name="cpd-options">
    <xs:sequence>
      <xs:element name="language" type="xs:string" minOccurs="0" maxOccurs="1" default="java"/>
      <xs:element name="minimum-tokens" type="xs:integer" minOccurs="0" maxOccurs="1" default="100"/>
      <xs:element name="max-memory" type="xs:string" minOccurs="0" maxOccurs="1" default="512m"/>
      <xs:element name="directories" type="directories" minOccurs="0" maxOccurs="1"/>
    </xs:sequence>
  </xs:complexType>
  <xs:complexType name="directories">
    <xs:sequence>
      <xs:element name="directory" type="xs:string" minOccurs="1" maxOccurs="unbounded"/>
    </xs:sequence>
  </xs:complexType>
</xs:schema>
