<?xml version="1.0"?>

<projectlist xmlns:xsi="http://www.w3.org/2001/XMLSchema-instance"
xsi:noNamespaceSchemaLocation="projectlist_1_3_0.xsd">
  <description>Standard Projects</description>

  <project>
    <name>checkstyle</name>
    <type>git</type>
    <connection>https://github.com/checkstyle/checkstyle</connection>
    <tag>checkstyle-9.1</tag>
    <exclude-pattern>.*/target/test-classes/com/puppycrawl/tools/checkstyle/.*</exclude-pattern>
    <exclude-pattern>.*/target/generated-sources/.*</exclude-pattern>
    <exclude-pattern>.*/src/test/resources-noncompilable/com/puppycrawl/tools/checkstyle/javaparser/InputJavaParserNoFreezeOnDeeplyNestedLambdas.java</exclude-pattern>
    <build-command>mvn test-compile -B</build-command>
    <auxclasspath-command>echo -n "$(pwd)/target/classes:"</auxclasspath-command>
    <cpd-options>
      <language>lava</language>
      <minimum-tokens>1001</minimum-tokens>
      <max-memory>42m</max-memory>
      <directories>
        <directory>src/main/java</directory>
        <directory>src/test/java</directory>
      </directories>
    </cpd-options>
  </project>

</projectlist>
