<?xml version="1.0"?>

<projectlist xmlns:xsi="http://www.w3.org/2001/XMLSchema-instance"
             xsi:noNamespaceSchemaLocation="projectlist_1_3_0.xsd">
  <description>Standard Projects</description>

  <project>
    <name>checkstyle</name>
    <type>git</type>
    <connection>https://github.com/checkstyle/checkstyle</connection>
    <tag>checkstyle-9.1</tag>

    <exclude-pattern>.*/target/test-classes/com/puppycrawl/tools/checkstyle/.*</exclude-pattern>
    <exclude-pattern>.*/target/generated-sources/.*</exclude-pattern>
    <exclude-pattern>.*/src/test/resources-noncompilable/com/puppycrawl/tools/checkstyle/javaparser/InputJavaParserNoFreezeOnDeeplyNestedLambdas.java</exclude-pattern>

    <build-command><![CDATA[#!/usr/bin/env bash
if test -e classpath.txt; then
  exit
fi

set -e

# Make sure to use java11. This is already installed by build.yml/publish-snapshot.yml/publish-release.yml
export JAVA_HOME=${HOME}/openjdk11
export PATH=$JAVA_HOME/bin:$PATH

mvn test-compile -B
mvn dependency:build-classpath -DincludeScope=test -Dmdep.outputFile=classpath.txt -B
]]></build-command>
    <auxclasspath-command>echo -n "${HOME}/openjdk11/lib/jrt-fs.jar:$(pwd)/target/classes:$(pwd)/target/test-classes:"; cat classpath.txt</auxclasspath-command>
    <cpd-options>
      <language>java</language>
      <minimum-tokens>150</minimum-tokens>
      <max-memory>4g</max-memory>
    </cpd-options>
  </project>

  <project>
    <name>spring-framework</name>
    <type>git</type>
    <connection>https://github.com/spring-projects/spring-framework</connection>
    <tag>v5.3.13</tag>

    <exclude-pattern>.*/build/generated-sources/.*</exclude-pattern>
    <exclude-pattern>.*/build/resources/.*</exclude-pattern>

    <build-command><![CDATA[#!/usr/bin/env bash
## Skip gradle execution
if test -e classpath.txt; then
  exit
fi

set -e

# Make sure to use java11. This is already installed by build.yml/publish-snapshot.yml/publish-release.yml
export JAVA_HOME=${HOME}/openjdk11
export PATH=$JAVA_HOME/bin:$PATH

## Patches
# keep the tabs!!
# Patch 1: See https://github.com/spring-projects/spring-framework/commit/381b7d035a16d430b8783b7390c1677c9e7d1f68
#          and https://github.com/spring-projects/spring-framework/commit/9e1ed6c7718d38c4b9fe5f75921abad33264307c
(cat <<EOF
diff --git a/spring-beans/src/main/java/org/springframework/beans/factory/annotation/AutowiredAnnotationBeanPostProcessor.java b/spring-beans/src/main/java/org/springframework/beans/factory/annotation/AutowiredAnnotationBeanPostProcessor.java
index 37f5884e67..53022443ee 100644
--- a/spring-beans/src/main/java/org/springframework/beans/factory/annotation/AutowiredAnnotationBeanPostProcessor.java
+++ b/spring-beans/src/main/java/org/springframework/beans/factory/annotation/AutowiredAnnotationBeanPostProcessor.java
@@ -539,7 +539,9 @@ public class AutowiredAnnotationBeanPostProcessor implements SmartInstantiationA
 	 */
 	@SuppressWarnings({"deprecation", "cast"})
 	protected boolean determineRequiredStatus(MergedAnnotation<?> ann) {
-		return determineRequiredStatus(
+		// Cast to (AnnotationAttributes) is required. Otherwise, the :spring-beans:compileGroovy
+		// task fails in the Gradle build.
+		return determineRequiredStatus((AnnotationAttributes)
 				ann.asMap(mergedAnnotation -> new AnnotationAttributes(mergedAnnotation.getType())));
 	}
 
EOF
) | patch --strip=1

# Patch 2: Ignore compiler warnings
(cat <<EOF
diff --git a/buildSrc/src/main/java/org/springframework/build/compile/CompilerConventionsPlugin.java b/buildSrc/src/main/java/org/springframework/build/compile/CompilerConventionsPlugin.java
index f2424c549e..b6ec8b04da 100644
--- a/buildSrc/src/main/java/org/springframework/build/compile/CompilerConventionsPlugin.java
+++ b/buildSrc/src/main/java/org/springframework/build/compile/CompilerConventionsPlugin.java
@@ -51,7 +51,7 @@ public class CompilerConventionsPlugin implements Plugin<Project> {
 		COMPILER_ARGS.addAll(commonCompilerArgs);
 		COMPILER_ARGS.addAll(Arrays.asList(
 				"-Xlint:varargs", "-Xlint:fallthrough", "-Xlint:rawtypes", "-Xlint:deprecation",
-				"-Xlint:unchecked", "-Werror"
+				"-Xlint:unchecked"//, "-Werror"
 		));
 		TEST_COMPILER_ARGS = new ArrayList<>();
 		TEST_COMPILER_ARGS.addAll(commonCompilerArgs);
diff --git a/spring-beans/spring-beans.gradle b/spring-beans/spring-beans.gradle
index e3f6f73b76..48c4d9e3fb 100644
--- a/spring-beans/spring-beans.gradle
+++ b/spring-beans/spring-beans.gradle
@@ -23,7 +23,7 @@ sourceSets {
 }
 
 compileGroovy {
-	options.compilerArgs += "-Werror"
+//	options.compilerArgs += "-Werror"
 }
 
 // This module also builds Kotlin code and the compileKotlin task naturally depends on
EOF
) | patch --strip=1

# Patch 3: Add task createSquishClasspath
(cat <<EOF
diff --git a/build.gradle b/build.gradle
index 6021fa574d..15d29ed699 100644
--- a/build.gradle
+++ b/build.gradle
@@ -431,3 +431,19 @@ configure(rootProject) {
 		}
 	}
 }
+
+// see https://stackoverflow.com/questions/28986968/generate-classpath-from-all-multiproject-gradle-build-dependencies
+task createSquishClasspath {
+  doLast {
+    def dependencies = new LinkedHashSet()
+    dependencies.addAll(moduleProjects.configurations.compileClasspath.resolvedConfiguration.resolvedArtifacts.file.flatten())
+    dependencies.addAll(moduleProjects.configurations.testCompileClasspath.resolvedConfiguration.resolvedArtifacts.file.flatten())
+
+    def paths = new ArrayList()
+    paths.addAll(moduleProjects.jar.outputs.files.asPath)
+    paths.addAll(moduleProjects.sourceSets.test.output.resourcesDir)
+    paths.addAll(moduleProjects.sourceSets.test.output.classesDirs.files.flatten())
+    paths.addAll(dependencies)
+    println paths.join(File.pathSeparator)
+  }
+}
EOF
) | patch --strip=1

# Patch 4: Add https://maven.repository.redhat.com/ga/ as repository in order to resolve
#   dependency com.ibm.websphere/uow/6.0.2.17
#   See https://spring.io/blog/2020/10/29/notice-of-permissions-changes-to-repo-spring-io-fall-and-winter-2020
(cat <<EOF
diff --git a/build.gradle b/build.gradle
index 6021fa57..8319ff76 100644
--- a/build.gradle
+++ b/build.gradle
@@ -291,6 +291,7 @@ configure(allprojects) { project ->
 		}
 		repositories {
 			mavenCentral()
+			maven { url "https://maven.repository.redhat.com/ga/" }
 			maven { url "https://repo.spring.io/libs-spring-framework-build" }
 		}
 	}
EOF
) | patch --strip=1

./gradlew --console=plain --build-cache --no-daemon --max-workers=4 build testClasses -x test -x javadoc -x api -x asciidoctor -x asciidoctorPdf
./gradlew --console=plain --build-cache --no-daemon --max-workers=4 createSquishClasspath -q > classpath.txt
]]></build-command>
    <auxclasspath-command>echo -n "${HOME}/openjdk11/lib/jrt-fs.jar:"; cat classpath.txt</auxclasspath-command>
    <cpd-options>
      <language>java</language>
      <minimum-tokens>150</minimum-tokens>
      <max-memory>4g</max-memory>
    </cpd-options>
  </project>

  <project>
    <name>openjdk-11</name>
    <type>git</type>
    <connection>https://github.com/openjdk/jdk</connection>
    <tag>jdk-11+28</tag>
    <src-subpath>src/java.base</src-subpath>
    <auxclasspath-command>echo -n "${HOME}/openjdk11/lib/jrt-fs.jar"</auxclasspath-command>
    <cpd-options>
      <language>java</language>
      <minimum-tokens>150</minimum-tokens>
      <max-memory>4g</max-memory>
      <directories>
        <directory>src/java.base</directory>
      </directories>
    </cpd-options>
  </project>

  <project>
    <name>Schedul-o-matic-9000</name>
    <type>git</type>
    <connection>https://github.com/SalesforceLabs/Schedul-o-matic-9000</connection>
    <tag>6b1229ba43b38931fbbab5924bc9b9611d19a786</tag>
    <cpd-options>
      <language>apex</language>
      <minimum-tokens>100</minimum-tokens>
      <max-memory>512m</max-memory>
    </cpd-options>
  </project>

  <project>
    <name>fflib-apex-common</name>
    <type>git</type>
    <connection>https://github.com/apex-enterprise-patterns/fflib-apex-common</connection>
    <tag>7e0891efb86d23de62811af56d87d0959082a322</tag>
    <cpd-options>
      <language>apex</language>
      <minimum-tokens>100</minimum-tokens>
      <max-memory>512m</max-memory>
    </cpd-options>
  </project>

  <project>
    <name>apex-link</name>
    <type>git</type>
    <connection>https://github.com/nawforce/apex-link</connection>
    <tag>v2.3.0</tag>
    <src-subpath>samples</src-subpath>
    <cpd-options>
      <language>apex</language>
      <minimum-tokens>100</minimum-tokens>
      <max-memory>512m</max-memory>
    </cpd-options>
  </project>

  <project>
    <name>java-regression-tests</name>
    <type>git</type>
    <connection>https://github.com/pmd/java-regression-tests</connection>
    <tag>main</tag>
    <auxclasspath-command>realpath java-regression-tests-*.jar</auxclasspath-command>
    <cpd-options>
      <language>java</language>
      <minimum-tokens>100</minimum-tokens>
      <max-memory>512m</max-memory>
    </cpd-options>
  </project>

  <project>
    <name>OracleDBUtils</name>
    <type>git</type>
    <connection>https://github.com/Qualtagh/OracleDBUtils</connection>
    <tag>0513fe6b053b31e6c09ac6f86eb2064733ecf32d</tag>
    <cpd-options>
      <language>plsql</language>
      <minimum-tokens>100</minimum-tokens>
      <max-memory>512m</max-memory>
    </cpd-options>
  </project>
</projectlist>
