<?xml version="1.0"?>

<projectlist xmlns:xsi="http://www.w3.org/2001/XMLSchema-instance"
xsi:noNamespaceSchemaLocation="projectlist_1_3_0.xsd">
  <description>Standard Projects</description>

  <project>
    <name>declarative-lookup-rollup-summaries</name>
    <type>git</type>
    <connection>https://github.com/SFDO-Community/declarative-lookup-rollup-summaries</connection>
    <tag>5dbd186bb057bc8aea13d24dcf94d561830376c1</tag>

    <cpd-options>
      <language>apex</language>
      <directories>
        <directory>src/main/java</directory>
        <directory>src/test/java</directory>
      </directories>
    </cpd-options>
  </project>
</projectlist>
