<?xml version="1.0"?>

<projectlist xmlns:xsi="http://www.w3.org/2001/XMLSchema-instance"
xsi:noNamespaceSchemaLocation="projectlist_1_3_0.xsd">
  <description>Projects used in integration_test_runner.rb</description>

  <project>
    <name>checkstyle</name>
    <type>git</type>
    <connection>https://github.com/checkstyle/checkstyle</connection>
    <tag>checkstyle-9.1</tag>

    <!-- this avoids analyzing src/test/resources-noncompilable ... -->
    <src-subpath>src/main/java</src-subpath>

    <build-command><![CDATA[#!/usr/bin/env bash
if test -e classpath.txt; then
  exit
fi

set -e

# Make sure to use java11. This is already installed by setup-java.
export JAVA_HOME=${HOME}/openjdk11
export PATH=$JAVA_HOME/bin:$PATH

mvn test-compile -B
mvn dependency:build-classpath -DincludeScope=test -Dmdep.outputFile=classpath.txt -B
]]></build-command>
    <auxclasspath-command>echo -n "$(pwd)/target/classes:$(pwd)/target/test-classes:"; cat classpath.txt</auxclasspath-command>

    <cpd-options>
      <language>java</language>
      <minimum-tokens>50</minimum-tokens>
      <max-memory>4g</max-memory>
      <directories>
        <!-- this avoids analyzing src/test/resources-noncompilable ... -->
        <directory>src/main/java</directory>
        <directory>src/test/java</directory>
      </directories>
    </cpd-options>
  </project>

  <!-- this project configuration is here, so that PMD's repo is cloned into target/repositories for integration tests -->
  <project>
    <name>pmd</name>
    <type>git</type>
    <connection>https://github.com/pmd/pmd</connection>
    <tag>pmd_releases/7.0.0</tag> <!-- this is already the correct checkout to speed up repeated integration tests -->

    <!-- just take a subset of pmd, to make the test faster -->
    <src-subpath>pmd-core/src/main/java</src-subpath>

    <cpd-options>
      <language>java</language>
      <minimum-tokens>50</minimum-tokens>
      <max-memory>4g</max-memory>
      <directories>
        <!-- just take a subset of pmd, to make the test faster -->
        <directory>pmd-core/src/main/java</directory>
        <directory>pmd-java/src/main/java</directory>
      </directories>
    </cpd-options>
  </project>
</projectlist>
